paper_id,title,abstract,label,doi
W2164609613,Association rules for rat spatial learning: The importance of the hippocampus for binding item identity with item location,"Three cohorts of rats with extensive hippocampal lesions received multiple tests to examine the relationships between particular forms of associative learning and an influential account of hippocampal function (the cognitive map hypothesis). Hippocampal lesions spared both the ability to discriminate two different digging media and to discriminate two different room locations in a go/no-go task when each location was approached from a single direction. Hippocampal lesions had, however, differential effects on a more complex task (biconditional discrimination) where the correct response was signaled by the presence or absence of specific cues. For all biconditional tasks, digging in one medium (A) was rewarded in the presence of cue C, while digging in medium B was rewarded in the presences of cue D. Such biconditional tasks are ""configural"" as no individual cue or element predicts the solution (AC+, AD-, BD+, and BC-). When proximal context cues signaled the correct digging choice, biconditional learning was seemingly unaffected by hippocampal lesions. Severe deficits occurred, however, when the correct digging choice was signaled by distal room cues. Also, impaired was the ability to discriminate two locations when each location was approached from two directions. A task demand that predicted those tasks impaired by hippocampal damage was the need to combine specific cues with their relative spatial positions (""structural learning""). This ability makes it possible to distinguish the same cues set in different spatial arrays. Thus, the hippocampus appears necessary for configural discriminations involving structure, discriminations that potentially underlie the creation of cognitive maps.",0,10.1002/hipo.22154
W2989258529,"The hippocampus, prefrontal cortex, and perirhinal cortex are critical to incidental order memory",,0,10.1016/j.bbr.2019.112215
W2123081263,A Sequence of events model of episodic memory shows parallels in rats and humans,"A critical feature of episodic memory is the ability to remember the order of events as they occurred in time, a capacity shared across species including humans, nonhuman primates, and rodents. Accumulating evidence suggests that this capacity depends on a network of structures including the hippocampus and the prefrontal cortex, but their respective contributions remain poorly understood. As addressing this important issue will require converging evidence from complementary investigative techniques, we developed a cross-species, nonspatial sequence memory task suitable for behavioral and neurophysiological studies in rodents and in humans. The task involves the repeated presentation of sequences of items (odors in rats and images in humans) and requires subjects to make a judgment as to whether each item is presented ""in sequence"" or ""out of sequence."" To shed light on the cognitive processes and sequence representations supporting performance, different types of ""out of sequence"" probe trials were used including: (i) repeating an item from earlier in the sequence (Repeats; e.g., ABAD), (ii) skipping ahead in the sequence (Skips; e.g., ABD), and (iii) inserting an item from a different sequence into the same ordinal position (Ordinal Transfers; e.g., A2CD). We found a remarkable similarity in the performance of rats and humans, particularly in the pattern of results across probe trial types. Thus, the results suggest that rats and humans not only remember the sequences of events, but also use similar underlying cognitive processes and mnemonic representations. This strong cross-species correspondence validates this task for use in future basic and clinical interdisciplinary studies aimed at examining the neural mechanisms underlying episodic memory.",0,10.1002/hipo.22301
W2256343763,Nonspatial Sequence Coding in CA1 Neurons,"The hippocampus is critical to the memory for sequences of events, a defining feature of episodic memory. However, the fundamental neuronal mechanisms underlying this capacity remain elusive. While considerable research indicates hippocampal neurons can represent sequences of locations, direct evidence of coding for the memory of sequential relationships among nonspatial events remains lacking. To address this important issue, we recorded neural activity in CA1 as rats performed a hippocampus-dependent sequence-memory task. Briefly, the task involves the presentation of repeated sequences of odors at a single port and requires rats to identify each item as ""in sequence"" or ""out of sequence"". We report that, while the animals' location and behavior remained constant, hippocampal activity differed depending on the temporal context of items-in this case, whether they were presented in or out of sequence. Some neurons showed this effect across items or sequence positions (general sequence cells), while others exhibited selectivity for specific conjunctions of item and sequence position information (conjunctive sequence cells) or for specific probe types (probe-specific sequence cells). We also found that the temporal context of individual trials could be accurately decoded from the activity of neuronal ensembles, that sequence coding at the single-cell and ensemble level was linked to sequence memory performance, and that slow-gamma oscillations (20-40 Hz) were more strongly modulated by temporal context and performance than theta oscillations (4-12 Hz). These findings provide compelling evidence that sequence coding extends beyond the domain of spatial trajectories and is thus a fundamental function of the hippocampus. SIGNIFICANCE STATEMENT: The ability to remember the order of life events depends on the hippocampus, but the underlying neural mechanisms remain poorly understood. Here we addressed this issue by recording neural activity in hippocampal region CA1 while rats performed a nonspatial sequence memory task. We found that hippocampal neurons code for the temporal context of items (whether odors were presented in the correct or incorrect sequential position) and that this activity is linked with memory performance. The discovery of this novel form of temporal coding in hippocampal neurons advances our fundamental understanding of the neurobiology of episodic memory and will serve as a foundation for our cross-species, multitechnique approach aimed at elucidating the neural mechanisms underlying memory impairments in aging and dementia.",0,10.1523/jneurosci.2874-15.2016
W2581869019,Incidental context information increases recollection,"The current study describes a receiver-operating characteristic (ROC) task for human participants based on the spontaneous recognition memory paradigms typically used with rodents. Recollection was significantly higher when an object was in the same location and background as at encoding, a combination used to assess episodic-like memory in animals, but not when only one of these task-irrelevant cues was present. The results show that incidentally encoded cue information can determine the degree of recollection, and opens up the possibility of assessing recollection across species in a single experimental paradigm, allowing better understanding of the cognitive and biological mechanisms at play.",0,10.1101/lm.042622.116
W2090932966,Learning about the context in genetically-defined mice,,0,10.1016/s0166-4328(01)00301-1
W1994999280,Hierarchical use of cues in the missing object recognition task by rats (Rattus norvegicus),,0,10.1016/j.beproc.2013.04.007
W595773546,The recognition of a novel-object in a novel context leads to hippocampal and parahippocampal c-Fos involvement,,0,10.1016/j.bbr.2015.06.012
W3024998196,The effects of morphine withdrawal and conditioned withdrawal on memory consolidation and c‐Fos expression in the central amygdala,"The current study tested the hypothesis that drug withdrawal contributes to the addiction cycle in part because of an action on memory consolidation. Hence, four experiments in male Sprague-Dawley rats compared the effects of precipitated morphine withdrawal and conditioned morphine withdrawal on the consolidation of object memory and on activation of c-Fos in the central nucleus of the amygdala (CeA). It was found that immediate, but not 6 h delayed, post sample administration of 3 mg/kg of naltrexone significantly enhanced object memory in rats maintained, or previously maintained, on 10 mg/kg/day of morphine via osmotic minipumps. To establish whether conditioned withdrawal could also alter object memory, a contextual conditioning procedure was employed whereby morphine-maintained (10 mg/kg/day) animals received naltrexone (3 mg/kg) in a distinctive context (CS+) and vehicle in a separate context (CS-) for 10 days. During conditioning in the CS+, naltrexone suppressed locomotor activity, caused a rapid body weight loss and increased frequency of wet dog shakes. Interestingly, confinement to this CS+ immediately, but not 6 h, after the sample phase, also enhanced object memory. Finally, posttraining naltrexone and exposure to the CS+ both induced significant expression of c-Fos in the CeA. Therefore, this study reports for the first time that both acute precipitated withdrawal and conditioned withdrawal can facilitate memory consolidation, possibly through a common neural pathway that involves the central amygdala.",0,10.1111/adb.12909
W2047378268,A Hierarchy of Associations in Hippocampo-Cortical Systems: Cognitive Maps and Navigation Strategies,"In this letter we describe a hippocampo-cortical model of spatial processing and navigation based on a cascade of increasingly complex associative processes that are also relevant for other hippocampal functions such as episodic memory. Associative learning of different types and the related pattern encoding-recognition take place at three successive levels: (1) an object location level, which computes the landmarks from merged multimodal sensory inputs in the parahippocampal cortices; (2) a subject location level, which computes place fields by combination of local views and movement-related information in the entorhinal cortex; and (3) a spatiotemporal level, which computes place transitions from contiguous place fields in the CA3-CA1 region, which form building blocks for learning temporospatial sequences. At the cell population level, superficial entorhinal place cells encode spatial, context-independent maps as landscapes of activity; populations of transition cells in the CA3-CA1 region encode context-dependent maps as sequences of transitions, which form graphs in prefrontal-parietal cortices. The model was tested on a robot moving in a real environment; these tests produced results that could help to interpret biological data. Two different goal-oriented navigation strategies were displayed depending on the type of map used by the system. Thanks to its multilevel, multimodal integration and behavioral implementation, the model suggests functional interpretations for largely unaccounted structural differences between hippocampo-cortical systems. Further, spatiotemporal information, a common denominator shared by several brain structures, could serve as a cognitive processing frame and a functional link, for example, during spatial navigation and episodic memory, as suggested by the applications of the model to other domains, temporal sequence learning and imitation in particular.",0,10.1162/0899766053630369
W2033499925,Differential roles of the dorsal hippocampal regions in the acquisition of spatial and temporal aspects of episodic-like memory,,0,10.1016/j.bbr.2012.04.022
W2989773178,Glycogen Synthase Kinase 3β in the Ventral Hippocampus is Important for Cocaine Reward and Object Location Memory,,0,10.1016/j.neuroscience.2019.10.055
W2065878391,The Vasopressin 1b Receptor Antagonist A-988315 Blocks Stress Effects on the Retrieval of Object-Recognition Memory,,0,10.1038/npp.2015.48
W2547610825,Long‐Lasting Effects of Chronic Intermittent Alcohol Exposure in Adolescent Mice on Object Recognition and Hippocampal Neuronal Activity,"BACKGROUND: Binge drinking is popular and highly prevalent in teenagers. However, the long-term cognitive and neurobiological consequences of such practices are not yet fully understood. In this context, we therefore assessed in mice whether a chronic intermittent alcohol (CIA) exposure in adolescence had long-term consequences on object discrimination and memory performances, emotional behaviors, brain activity, and morphology. METHODS: C57BL/6JRj mice were treated with either saline or ethanol (EtOH) (2 g/kg/d, i.p., from postnatal days [PND] 30 to PND 44 every other day). The day following the last administration or later in adulthood (PND 71) mice were tested for different behavioral tests (novel object recognition, spontaneous alternation, light-dark box, elevated plus-maze, actimeter test), to assess object recognition, working memory performances, anxiety-like behavior, and locomotor activity. We also investigated neuronal activation of hippocampus, prefrontal and perirhinal cortices, and anatomical changes using immediate-early gene expression and longitudinal brain magnetic resonance imaging. RESULTS: Our results showed that adolescent mice exposed to CIA present a critical and persistent impairment of short-term object recognition performances. By contrast, spatial working memory was not impaired, nor was anxiety-like behavior. This altered object discrimination was associated with a biphasic change in neuronal activity in the hippocampus but without morphological changes. Indeed, c-Fos expression was specifically increased in the dorsal dentate gyrus (DG) of the hippocampus after the binge exposure, but then became significantly lower in adulthood both in the DG and the CA1 part of the hippocampus compared with adult saline pretreated mice. CONCLUSIONS: These findings provide evidence for adolescent vulnerability to the effects of intermittent binge EtOH exposure on object discrimination and hippocampal activity with long-lasting consequences.",0,10.1111/acer.13256
W151073356,Sex differences in behavioral and neurochemical profiles after chronic stress,,0,10.1016/s0031-9384(02)00670-4
W2111229642,Early deprivation induces competitive subordinance in C57BL/6 male mice,"Rodent models have been widely used to investigate the impact of early life stress on adult health and behavior. However, the social dimension has rarely been incorporated into the analysis due to methodological limitations. This study characterized the effects of neonatal social isolation (early deprivation, ED) on adult C57BL/6 mouse behavior in a social context using our recently developed behavioral test protocols for group-housed mice. During the first two postnatal weeks, half of the pups per dam were separated from their dam and littermates for 3h per day (ED group). Post weaning, ED and control pups were electronically tagged and co-housed. At 12weeks, the mixed cohorts were transferred to IntelliCages, equipped with computer-controlled operant chambers. Access to the chambers was used as an index to analyze novel object response, behavioral flexibility, and competitive dominance with minimal experimenter intervention. In general, ED had greater effects on males; ED males exhibited reduced body weight, increased novelty response, and were subordinate to control littermates when competing for reward access. Male ED mice also demonstrated mildly impaired reversal learning. Analyzing gene expression changes in brain regions controlling emotion, stress, spatial memory, and executive function revealed reduced BDNF and c-Fos in hippocampal CA1, enhanced c-Fos in the basolateral amygdala, reduced Map2 while enhanced HSD11β2 in prefrontal cortex of ED males. In male mice, it was suggested that neonatal social isolation results in sustained changes in social behavior with altered function of limbic and frontal cortices.",0,10.1016/j.physbeh.2014.06.018
W2530286629,Chronic Caffeine’s Effects on Behavioural Changes in Streptozotocininduced Diabetic Rats,"CONTEXT: Memory deficits, anxiety and depression are often associated with diabetes, worsening diabetic patients' prognosis. Caffeine, a worldwide used psychoactive substance, is a candidate for improving these conditions. OBJECTIVE: The aim of this study was to assess the behaviour in streptozotocin-induced diabetic Wistar rats and to evaluate the behavioural effects of caffeine administration. MATERIALS AND METHODS: Diabetes was induced by a single intraperitoneal injection of 50 mg/kg BW streptozotocin (n=10), while control rats received the vehicle (n=9). After six weeks, behavioural tests for anxiety, memory and depression were performed: elevated plus maze (EPM) test, novel object recognition (NOR) test and forced swimming test (FST), respectively. The tests were repeated after further 2 weeks of continuous caffeine administration (20 mg/kg BW/day in drinking water). RESULTS: Diabetic rats manifested a high anxiety level, showed by a reduced exploratory activity compared to control rats (p<0.05) and long-term memory impairment, spending more time near the old object in NOR test. Caffeine administered for 2 weeks did not modify glycemic values in either group, and attenuated the behavioural changes observed in the EPM test. Also, in NOR test for long-term memory, caffeine administration induced an increased time spent with the novel object than with the old one in both groups. CONCLUSIONS: Our data suggest that chronic caffeine administration has an anxiolytic effect in diabetic rats and improves long-term memory in both diabetic and control rats.",0,10.4183/aeb.2016.268
W2954000323,In a Temporally Segmented Experience Hippocampal Neurons Represent Temporally Drifting Context But Not Discrete Segments,"There is widespread agreement that episodic memory is organized into a timeline of past experiences. Recent work suggests that the hippocampus may parse the flow of experience into discrete episodes separated by event boundaries. A complementary body of work suggests that context changes gradually as experience unfolds. We recorded from hippocampal neurons as male Long-Evans rats performed 6 blocks of an object discrimination task in sets of 15 trials. Each block was separated by removal from the testing chamber for a delay to enable segmentation. The reward contingency reversed from one block to the next to incentivize segmentation. We expected animals to hold two distinct, recurring representations of context to match the two distinct rule contingencies. Instead, we found that overtrained rats began each block neither above nor below chance but by guessing randomly. While many units had clear firing fields selective to the conjunction of objects in places, a significant population also reflected a continuously drifting code both within block and across blocks. Despite clear boundaries between blocks, we saw no neural evidence for event segmentation in this experiment. Rather, the hippocampal ensemble drifted continuously across time. This continuous drift in the neural representation was consistent with the lack of segmentation observed in behavior.",0,10.1523/jneurosci.1420-18.2019
W2566413010,Respective role of the dorsal hippocampus and the entorhinal cortex during the recombination of previously learned olfactory–tactile associations in the rat,"The hippocampal formation has been extensively described as a key component for object recognition in conjunction with place and context. The present study aimed at describing neural mechanisms in the hippocampal formation that support olfactory-tactile (OT) object discrimination in a task where space and context were not taken into account. The task consisted in discriminating one baited cup among three, each of them presenting overlapping olfactory or tactile elements. The experiment tested the involvement of the entorhinal cortex (EC) and the dorsal hippocampus (DH) in the acquisition of this cross-modal task, either with new items or with familiar but recombined items. The main results showed that DH inactivation or cholinergic muscarinic blockade in the DH selectively and drastically disrupted performance in the recombination task. EC inactivation impaired OT acquisition of any OT combinations while cholinergic blockade only delayed it. Control experiments showed that neither DH nor EC inactivation impaired unimodal olfactory or tactile tasks. As a whole, these data suggest that DH-EC interactions are of importance for flexibility of cross-modal representations with overlapping elements.",0,10.1101/lm.043299.116
W2791684544,5-HT6 receptor agonist and antagonist modulates ICV-STZ-induced memory impairment in rats,,0,10.1007/s00213-018-4866-z
W1937888283,Running Improves Pattern Separation during Novel Object Recognition,"Running increases adult neurogenesis and improves pattern separation in various memory tasks including context fear conditioning or touch-screen based spatial learning. However, it is unknown whether pattern separation is improved in spontaneous behavior, not emotionally biased by positive or negative reinforcement. Here we investigated the effect of voluntary running on pattern separation during novel object recognition in mice using relatively similar or substantially different objects.We show that running increases hippocampal neurogenesis but does not affect object recognition memory with 1.5 h delay after sample phase. By contrast, at 24 h delay, running significantly improves recognition memory for similar objects, whereas highly different objects can be distinguished by both, running and sedentary mice. These data show that physical exercise improves pattern separation, independent of negative or positive reinforcement. In sedentary mice there is a pronounced temporal gradient for remembering object details. In running mice, however, increased neurogenesis improves hippocampal coding and temporally preserves distinction of novel objects from familiar ones.",0,10.3233/bpl-150010
W1983503722,Effects of the nitric oxide synthase inhibitor L-NAME on different memory components as assessed in the object recognition task in the rat,,0,10.1016/j.bbr.2009.10.007
W2902837106,Effects of adolescent Bisphenol-A exposure on memory and spine density in ovariectomized female rats: Adolescence vs adulthood,,0,10.1016/j.yhbeh.2018.11.004
W2529151044,The use of the Emotional-Object Recognition as an assay to assess learning and memory associated to an aversive stimulus in rodents,,0,10.1016/j.jneumeth.2016.09.010
W2742471118,The non-coding RNA BC1 regulates experience-dependent structural plasticity and learning,"The brain cytoplasmic (BC1) RNA is a non-coding RNA (ncRNA) involved in neuronal translational control. Absence of BC1 is associated with altered glutamatergic transmission and maladaptive behavior. Here, we show that pyramidal neurons in the barrel cortex of BC1 knock out (KO) mice display larger excitatory postsynaptic currents and increased spontaneous activity in vivo. Furthermore, BC1 KO mice have enlarged spine heads and postsynaptic densities and increased synaptic levels of glutamate receptors and PSD-95. Of note, BC1 KO mice show aberrant structural plasticity in response to whisker deprivation, impaired texture novel object recognition and altered social behavior. Thus, our study highlights a role for BC1 RNA in experience-dependent plasticity and learning in the mammalian adult neocortex, and provides insight into the function of brain ncRNAs regulating synaptic transmission, plasticity and behavior, with potential relevance in the context of intellectual disabilities and psychiatric disorders.Brain cytoplasmic (BC1) RNA is a non-coding RNA that has been implicated in translational regulation, seizure, and anxiety. Here, the authors show that in the cortex, BC1 RNA is required for sensory deprivation-induced structural plasticity of dendritic spines, as well as for correct sensory learning and social behaviors.",0,10.1038/s41467-017-00311-2
W2789966204,Maternal high fructose diet and neonatal immune challenge alter offspring anxiety-like behavior and inflammation across the lifespan,,1,10.1016/j.lfs.2018.02.010
