paper_id,title,abstract,label,doi
W1988714375,"Impact of adolescent sucrose access on cognitive control, recognition memory, and parvalbumin immunoreactivity","In this study we sought to determine the effect of daily sucrose consumption in young rats on their subsequent performance in tasks that involve the prefrontal cortex and hippocampus. High levels of sugar consumption have been associated with the development of obesity, however less is known about how sugar consumption influences behavioral control and high-order cognitive processes. Of particular concern is the fact that sugar intake is greatest in adolescence, an important neurodevelopmental period. We provided sucrose to rats when they were progressing through puberty and adolescence. Cognitive performance was assessed in adulthood on a task related to executive function, a rodent analog of the Stroop task. We found that sucrose-exposed rats failed to show context-appropriate responding during incongruent stimulus compounds presented at test, indicative of impairments in prefrontal cortex function. Sucrose exposed rats also showed deficits in an on object-in-place recognition memory task, indicating that both prefrontal and hippocampal function was impaired. Analysis of brains showed a reduction in expression of parvalbumin-immunoreactive GABAergic interneurons in the hippocampus and prefrontal cortex, indicating that sucrose consumption during adolescence induced long-term pathology, potentially underpinning the cognitive deficits observed. These results suggest that consumption of high levels of sugar-sweetened beverages by adolescents may also impair neurocognitive functions affecting decision-making and memory, potentially rendering them at risk for developing mental health disorders.",0,10.1101/lm.038000.114
W1993553515,New automated procedure to assess context recognition memory in mice,,0,10.1007/s00213-014-3577-3
W2739540400,Stress Facilitates the Development of Cognitive Dysfunction After Chronic Ethanol Exposure,"BACKGROUND: Chronic exposure to stress or alcohol can drive neuroadaptations that alter cognition. Alterations in cognition may contribute to alcohol use disorders by reducing cognitive control over drinking and maintenance of abstinence. Here we examined effects of combined ethanol (EtOH) and stress exposure on prefrontal cortex (PFC)-dependent cognition. METHODS: Adult male C57BL/6J mice were trained to drink EtOH (15%, v/v) on a 1 h/d 1-bottle schedule. Once stable, mice were exposed to cycles of chronic intermittent EtOH (CIE) or air-control vapor exposure (Air), followed by test cycles of 1 h/d EtOH drinking. During test drinking, mice received no stress (NS) or 10 minutes of forced swim stress (FSS) 4 hours before each test. This schedule produced 4 experimental groups: control, Air/NS; EtOH-dependent no stress, CIE/NS; nondependent stress, Air/FSS; or EtOH-dependent stress, CIE/FSS. After 2 cycles of CIE and FSS exposure, we assessed PFC-dependent cognition using object/context recognition and attentional set shifting. At the end of the study, mice were perfused and brains were collected for measurement of c-Fos activity in PFC and locus coeruleus (LC). RESULTS: CIE/FSS mice escalated EtOH intake faster than CIE/NS and consumed more EtOH than Air/NS across all test cycles. After 2 cycles of CIE/FSS, mice showed impairments in contextual learning and extradimensional set-shifting relative to other groups. In addition to cognitive dysfunction, CIE/FSS mice demonstrated widespread reductions in c-Fos activity within prelimbic and infralimbic PFC as well as LC. CONCLUSIONS: Together, these findings show that interactions between EtOH and stress exposure rapidly lead to disruptions in signaling across cognitive networks and impairments in PFC-dependent cognitive function.",0,10.1111/acer.13444
W2001595726,"Exploration, fear and maze learning in spontaneously hypertensive and normotensive rats",,0,10.1016/s0163-1047(88)90528-6
W2073498631,<i>Thunbergia laurifolia</i>extract ameliorates cognitive and emotional deficits in olfactorectomized mice,"CONTEXT: Thunbergia laurifolia Lindl. (Acanthaceae) is a Thai medicinal plant used for the detoxification of poison which is likely to be beneficial for the treatment of cognitive deficits including Alzheimer's disease. OBJECTIVE: To elucidate the effects of Thunbergia laurifolia leaf extract (TLL) on cognitive dysfunction and depression-like behavior in olfactory bulbectomized mice (OBX). MATERIALS AND METHODS: OBX mice were treated daily with TLL at the dose of 250 and 500 mg/kg, tacrine, and imipramine, on the day after 10 d of OBX operation. The effects of TLL on cognitive and depression-like behavior of the animals were analyzed. After completing behavioral experiments, the expression levels of cholinergic marker genes encoding ChAT and muscarinic M1 receptor were quantitatively analyzed. RESULTS: TLL and tacrine reduced OBX-induced cognitive deficits in the object recognition test (ORT) with the time spent for the novel object two times longer than that of the familiar object. Moreover, TLL at the dose of 500 mg/kg and imipramine ameliorated depression-like behavior in the tail suspension test (TST) by reducing the duration of immobility from 25.18% to 3.16% and from 25.18% to 6.48%, respectively. TLL at the dose of 250 and 500 mg/kg reversed the OBX-induced down-regulation of ChAT mRNA expression in the hippocampus from 0.12 to 0.17 and 0.24, respectively, while the down-regulation of mRNA expression of muscarinic M1 receptor was also reversed by TLL from 0.23 to 0.38 and 0.48, respectively. CONCLUSIONS: TLL ameliorates non-spatial short-term memory deficits in OBX mice, and has the potential to exhibit an antidepressant-like action.",0,10.3109/13880209.2014.962059
W889908523,"Pattern separation, completion, and categorisation in the hippocampus and neocortex",,0,10.1016/j.nlm.2015.07.008
W2129399226,Glucocorticoid enhancement of memory requires arousal-induced noradrenergic activation in the basolateral amygdala,"Considerable evidence indicates that glucocorticoid hormones enhance the consolidation of long-term memories for emotionally arousing experiences but not that for less arousing or neutral information. However, previous studies have not determined the basis of such arousal-induced selectivity. Here we report the finding that endogenous noradrenergic activation of the basolateral complex of the amygdala (BLA) induced by emotional arousal is essential in enabling glucocorticoid memory enhancement. Corticosterone administered immediately after object recognition training enhanced 24-h memory of naïve male rats but not that of rats previously habituated to the training context in order to reduce novelty-induced emotional arousal. The beta-adrenoceptor antagonist propranolol administered either systemically or into the BLA blocked the corticosterone-induced memory enhancement. Further, in habituated rats, corticosterone activated BLA neurons, as assessed by phosphorylated cAMP response element binding (pCREB) immunoreactivity levels, and enhanced memory only when norepinephrine release was stimulated by administration of the alpha(2)-adrenoceptor antagonist yohimbine. These findings strongly suggest that synergistic actions of glucocorticoids and emotional arousal-induced noradrenergic activation of the BLA constitute a neural mechanism by which glucocorticoids may selectively enhance memory consolidation for emotionally arousing experiences.",0,10.1073/pnas.0601874103
W2585648466,Effects of dorsal hippocampus catecholamine depletion on paired-associates learning and place learning in rats,,0,10.1016/j.bbr.2017.01.038
W2808582902,An isoform-selective p38α mitogen-activated protein kinase inhibitor rescues early entorhinal cortex dysfunctions in a mouse model of Alzheimer's disease,,0,10.1016/j.neurobiolaging.2018.06.006
W2890732605,Cocaine Paired Environment Increases SATB2 Levels in the Rat Paraventricular Thalamus,"SATB2 is a DNA binding protein that specifically binds the nuclear matrix attachment region and functions as a regulator of the transcription of large chromatin domains. Unlike its well addressed role during brain development, the role of SATB2 in adult brain is under-investigated. It has been shown that deletion of SATB2 from the forebrain of adult mice significantly impaired long-term memory for contextual fear and object recognition memory. The aim of the present study was to investigate the effects of appetitive stimuli such as cocaine and social interaction (SI) on SATB2 expression in the adult rat brain. For that, we performed conditioned place preference (CPP) to cocaine (15 mg/kg) and to SI, then assessed SATB2 expression in the brain 1 h (24 h after the last conditioning) and 24 h (48 h after the last conditioning) after the CPP test. We found that SATB2 expression in the paraventricular thalamus of rats was increased 1 h after the cocaine CPP test. This increase was selective for the cocaine-paired environment since the SI-paired environment did not increase SATB2 expression in the paraventricular thalamus. Also, the cocaine paired environment-induced increase of SATB2 levels in the paraventricular thalamus was due to cocaine conditioning as the unpaired cocaine group did not show an increase of SATB2 in the paraventricular thalamus. These results suggest that SATB2 in the paraventricular thalamus appears to be involved in the association between cocaine effects and environmental context. Further studies are needed to address the functional role of SATB2 in cocaine conditioning.",0,10.3389/fnbeh.2018.00224
W2101348422,The role of rewarding and novel events in facilitating memory persistence in a separate spatial memory task,"Many insignificant events in our daily life are forgotten quickly but can be remembered for longer when other memory-modulating events occur before or after them. This phenomenon has been investigated in animal models in a protocol in which weak memories persist longer if exploration in a novel context is introduced around the time of memory encoding. This study aims to understand whether other types of rewarding or novel tasks, such as rewarded learning in a T-maze and novel object recognition, can also be effective memory-modulating events. Rats were trained in a delayed matching-to-place task to encode and retrieve food locations in an event arena. Weak encoding with only one food pellet at the sample location induced memory encoding but forgetting over 24 h. When this same weak encoding was followed by a rewarded task in a T-maze, the memory persisted for 24 h. Moreover, the same persistence of memory over 24 h could be achieved by exploration in a novel box or by a rewarded T-maze task after a ""non-rewarded"" weak encoding. When the one-pellet weak encoding was followed by novel object exploration, the memory did not persist at 24 h. Together, the results confirm that place encoding is possible without explicit reward, and that rewarded learning in a separate task lacking novelty can be an effective memory-modulating event. The behavioral and neurobiological implications are discussed.",0,10.1101/lm.032177.113
W2079142947,Deletion of the GluA1 AMPA receptor subunit impairs recency-dependent object recognition memory,"Deletion of the GluA1 AMPA receptor subunit impairs short-term spatial recognition memory. It has been suggested that short-term recognition depends upon memory caused by the recent presentation of a stimulus that is independent of contextual-retrieval processes. The aim of the present set of experiments was to test whether the role of GluA1 extends to nonspatial recognition memory. Wild-type and GluA1 knockout mice were tested on the standard object recognition task and a context-independent recognition task that required recency-dependent memory. In a first set of experiments it was found that GluA1 deletion failed to impair performance on either of the object recognition or recency-dependent tasks. However, GluA1 knockout mice displayed increased levels of exploration of the objects in both the sample and test phases compared to controls. In contrast, when the time that GluA1 knockout mice spent exploring the objects was yoked to control mice during the sample phase, it was found that GluA1 deletion now impaired performance on both the object recognition and the recency-dependent tasks. GluA1 deletion failed to impair performance on a context-dependent recognition task regardless of whether object exposure in knockout mice was yoked to controls or not. These results demonstrate that GluA1 is necessary for nonspatial as well as spatial recognition memory and plays an important role in recency-dependent memory processes.",1,10.1101/lm.2083411
W2286848419,Long-Term Cognitive Deficits After Subarachnoid Hemorrhage in Rats,,0,10.1007/s12028-016-0250-1
W2915036951,Role for Chromatin Remodeling Factor Chd1 in Learning and Memory,"genomic locus in the hippocampus and in cultured cells. Together these data support a role for Chd1 as a critical regulator of molecular mechanisms governing memory-related processes, and they show that this function involves the N-terminal serine-rich region of the protein.",0,10.3389/fnmol.2019.00003
W2040347331,Acute Physiological Stress Promotes Clustering of Synaptic Markers and Alters Spine Morphology in the Hippocampus,"GluA2-containing AMPA receptors and their association with protein kinase M zeta (PKMζ) and post-synaptic density-95 (PSD-95) are important for learning, memory and synaptic plasticity processes. Here we investigated these synaptic markers in the context of an acute 1h platform stress, which can disrupt spatial memory retrieval for a short-term memory on the object placement task and long-term memory retrieval on a well-learned radial arm maze task. Acute stress increased serum corticosterone and elevated the expression of synaptic PKMζ while decreasing synaptic GluA2. Using co-immunoprecipitation, we found that this stressor promotes the clustering of GluA2, PKMζ and PSD-95, which is consistent with effects reported from overexpression of PKMζ in cell culture. Because PKMζ overexpression has also been shown to induce spine maturation in culture, we examined how stress impacts synaptic markers within changing spines across various hippocampal subfields. To achieve this, we employed a new technique combining Golgi staining and immmunohistochemistry to perform 3D reconstruction of tertiary dendrites, which can be analyzed for differences in spine types and the colocalization of synaptic markers within these spines. In CA1, stress increased the densities of long-thin and mushroom spines and the colocalization of GluA2/PSD-95 within these spines. Conversely, in CA3, stress decreased the densities of filopodia and stubby spines, with a concomitant reduction in the colocalization of GluA2/PSD-95 within these spines. In the outer molecular layer (OML) of the dentate gyrus (DG), stress increased both stubby and long-thin spines, together with greater GluA2/PSD-95 colocalization. These data reflect the rapid effects of stress on inducing morphological changes within specific hippocampal subfields, highlighting a potential mechanism by which stress can modulate memory consolidation and retrieval.",0,10.1371/journal.pone.0079077
W2021167033,"Stress Hormones Receptors in the Amygdala Mediate the Effects of Stress on the Consolidation, but Not the Retrieval, of a Non Aversive Spatial Task","This study examined the effects of the arousal level of the rat and exposure to a behavioral stressor on acquisition, consolidation and retrieval of a non-aversive hippocampal-dependent learning paradigm, the object location task. Learning was tested under two arousal conditions: no previous habituation to the experimental context (high novelty stress/arousal level) or extensive prior habituation (reduced novelty stress/arousal level). Results indicated that in the habituated rats, exposure to an out-of-context stressor (i.e, elevated platform stress) impaired consolidation and retrieval, but not acquisition, of the task. Non-habituated animals under both stressed and control conditions did not show retention of the task. In habituated rats, RU-486 (10 ng/side), a glucocorticoid receptor (GR) antagonist, or propranolol (0.75 µg/side), a beta-adrenergic antagonist, injected into the basolateral amygdala (BLA), prevented the impairing effects of the stressor on consolidation, but not on retrieval. The CB1/CB2 receptor agonist WIN55,212-2 (WIN, 5 µg/side) microinjected into the BLA did not prevent the effects of stress on either consolidation or retrieval. Taken together the results suggest that: (i) GR and β-adrenergic receptors in the BLA mediate the impairing effects of stress on the consolidation, but not the retrieval, of a neutral, non-aversive hippocampal-dependent task, (ii) the impairing effects of stress on hippocampal consolidation and retrieval are mediated by different neural mechanisms (i.e., different neurotransmitters or different brain areas), and (iii) the effects of stress on memory depend on the interaction between several main factors such as the stage of memory processing under investigation, the animal's level of arousal and the nature of the task (neutral or aversive).",0,10.1371/journal.pone.0029988
W2512118283,25th Annual Computational Neuroscience Meeting: CNS-2016,"Abstracts of the 25th Annual Computational Neuroscience\nMeeting: CNS-2016\nSeogwipo City, Jeju-do, South Korea. 2–7 July 2016",0,10.1186/s12868-016-0283-6
W2031820336,Positive allosteric activation of GABAA receptors bi-directionally modulates hippocampal glutamate plasticity and behaviour,"Long-term BZ (benzodiazepine) anxiolytic therapy increases the risk of physical dependence manifested as withdrawal anxiety. BZ-induced potentiation of GABA(A)R (gamma-aminobutyric acid type-A receptor) function by 1-week oral administration of FZP (flurazepam) bi-directionally modulates excitatory glutamatergic synaptic transmission in hippocampal CA1 neurons during drug withdrawal. Previous electrophysiological studies on acutely isolated and intact CA1 neurons, as well as immunofluorescence and post-embedding immunogold electron microscopy studies, suggest increased synaptic insertion of GluR (glutamate receptor) 2-lacking AMPARs (alpha-amino-3-hydroxy-5-methylisoxazole-4-propionic acid receptors) in 2-day FZP-withdrawn rats. Preliminary studies indicated a similar increase in GluR1, then phospho-Ser(831)-GluR1, as well as CaMKIIalpha (Ca(2+)/calmodulin-dependent protein kinase IIalpha), but not phospho-Thr(286)-CaMKII levels at the same time point. In our studies, whole-cell recordings in hippocampal slices revealed that AMPAR mEPSC [miniature EPSC (excitatory postsynaptic current)] amplitude was increased in 1-day FZP-withdrawn rats followed by an increase in estimated single-channel conductance in 2-day-FZP-withdrawn rats. Enhanced conductance was no longer observed in slices pre-incubated for 2 h in the CaMKII inhibitor KN-93, but not the inactive analogue KN-92. To evaluate whether CaMKII-mediated AMPA potentiation could occlude LTP (long-term potentiation), LTP was induced by TBS (theta burst stimulation) and recorded using whole-cell and extracellular techniques. LTP was induced in both groups, but only maintained for <15 min in 2-day FZP-withdrawn rats. LTP was fully restored after 7-day withdrawal. Despite the lack of LTP maintenance, impairment of object recognition, place and context was not observed in 2-day-FZP-withdrawn rats. Since L-VGCC (L-type voltage-gated calcium channel) current density was doubled on drug withdrawal and up to 2 days, Ca(2+) entry through L-VGCCs and perhaps subsequently through Ca(2+)-permeable AMPARs are proposed to be responsible for enhanced CaMKIIalpha levels and AMPAR potentiation. Mechanisms associated with several different models of activity-dependent plasticity may underlie BZ physical dependence.",0,10.1042/bst0371394
W2046706409,Enhanced recognition memory following glycine transporter 1 deletion in forebrain neurons.,"Selective deletion of glycine transporter 1 (GlyT1) in forebrain neurons enhances N-methyl-D-aspartate receptor (NMDAR)-dependent neurotransmission and facilitates associative learning. These effects are attributable to increases in extracellular glycine availability in forebrain neurons due to reduced glycine re-uptake. Using a forebrain- and neuron-specific GlyT1-knockout mouse line (CamKIIalphaCre; GlyT1tm1.2fl/fI), the authors investigated whether this molecular intervention can affect recognition memory. In a spontaneous object recognition memory test, enhanced preference for a novel object was demonstrated in mutant mice relative to littermate control subjects at a retention interval of 2 hr, but not at 2 min. Furthermore, mutants were responsive to a switch in the relative spatial positions of objects, whereas control subjects were not. These potential procognitive effects were demonstrated against a lack of difference in contextual novelty detection: Mutant and control subjects showed equivalent preference for a novel over a familiar context. Results therefore extend the possible range of potential promnesic effects of specific forebrain neuronal GlyT1 deletion from associative learning to recognition memory and further support the possibility that mnemonic functions can be enhanced by reducing GlyT1 function.",0,10.1037/0735-7044.121.5.815
W2780333711,Comparative effect of<i>Camellia sinensis</i>teas on object recognition test deficit and metabolic changes induced by cafeteria diet,"According to the results obtained it is possible to conclude that green tea was better than other teas in reducing effects of the CD model, being able to protect a greater number of parameters.",0,10.1080/1028415x.2017.1418726
W2789103057,"Endocrine active metals, prenatal stress and enhanced neurobehavioral disruption",,0,10.1016/j.yhbeh.2018.01.004
W4255367522,Whisking,,0,10.1016/j.cub.2015.01.008
W1991045544,Object/Context Specific Memory Deficits following Medial Frontal Cortex Damage in Mice,"Recent evidence suggests that the medial prefrontal cortex (MFC) is important for processing contextual information. Here we evaluate the performance of mice with MFC damage in a discrimination task that requires an association between an object and the context in which it was experienced (the object/context mismatch task), as well as a version of the novel object preference task that does not require knowledge of contextual information to resolve. Adult C57/BL6 mice received aspiration lesions of the MFC or control surgery. Upon recovery, mice were tested in the object/context mismatch and novel object preference tasks. The object/context mismatch task involved exposing mice to two different contexts, each of which housed a unique pair of identical objects. After a brief delay, mice were re-exposed to one of the contexts, this time with one object that was congruent with that context and one that was not. Novel object preference was performed within a single context, housing an identical pair of objects. After the initial exposure and following a brief delay, mice were re-exposed to the context, this time housing a familiar and a novel object. Control mice were able to successfully resolve the object/context mismatch and novel object preference discriminations, investigating the incongruent/novel object within each task significantly greater than chance. Mice with MFC damage experienced deficits in the object/context mismatch task but not the novel object preference task. These findings add to a growing body of evidence that demonstrate a critical role for the MFC in contextual information processing.",1,10.1371/journal.pone.0043698
W2460180473,Hippocampal Attractor Dynamics Predict Memory-Based Decision Making,,0,10.1016/j.cub.2016.04.063
W755518143,Systemic administration of riluzole enhances recognition memory and facilitates extinction of fear memory in rats,,0,10.1016/j.neuropharm.2015.06.007
W2565486508,Modulation of recognition memory performance by light requires both melanopsin and classical photoreceptors,"Acute light exposure exerts various effects on physiology and behaviour. Although the effects of light on brain network activity in humans are well demonstrated, the effects of light on cognitive performance are inconclusive, with the size, as well as direction, of the effect depending on the nature of the task. Similarly, in nocturnal rodents, bright light can either facilitate or disrupt performance depending on the type of task employed. Crucially, it is unclear whether the effects of light on behavioural performance are mediated via the classical image-forming rods and cones or the melanopsin-expressing photosensitive retinal ganglion cells. Here, we investigate the modulatory effects of light on memory performance in mice using the spontaneous object recognition task. Importantly, we examine which photoreceptors are required to mediate the effects of light on memory performance. By using a cross-over design, we show that object recognition memory is disrupted when the test phase is conducted under a bright light (350 lux), regardless of the light level in the sample phase (10 or 350 lux), demonstrating that exposure to a bright light at the time of test, rather than at the time of encoding, impairs performance. Strikingly, the modulatory effect of light on memory performance is completely abolished in both melanopsin-deficient and rodless-coneless mice. Our findings provide direct evidence that melanopsin-driven and rod/cone-driven photoresponses are integrated in order to mediate the effect of light on memory performance.",0,10.1098/rspb.2016.2275
W2951497943,Memory deficits in males and females long after subchronic immune challenge,,0,10.1016/j.nlm.2019.01.003
