paper_id,title,abstract,label,doi
W2557286791,Satb2 determines miRNA expression and long-term memory in the adult central nervous system,"is a risk locus for schizophrenia and encodes a DNA-binding protein that regulates higher-order chromatin configuration. In the adult brain Satb2 is almost exclusively expressed in pyramidal neurons of two brain regions important for memory formation, the cerebral cortex and the CA1-hippocampal field. Here we show that Satb2 is required for key hippocampal functions since deletion of Satb2 from the adult mouse forebrain prevents the stabilization of synaptic long-term potentiation and markedly impairs long-term fear and object discrimination memory. At the molecular level, we find that synaptic activity and BDNF up-regulate Satb2, which itself binds to the promoters of coding and non-coding genes. Satb2 controls the hippocampal levels of a large cohort of miRNAs, many of which are implicated in synaptic plasticity and memory formation. Together, our findings demonstrate that Satb2 is critically involved in long-term plasticity processes in the adult forebrain that underlie the consolidation and stabilization of context-linked memory.",0,10.7554/elife.17361
W2010047416,Motor and behavioral phenotype in conditional mutants with targeted ablation of cortical D1 dopamine receptor-expressing cells,,0,10.1016/j.nbd.2015.02.006
W2320791329,Meloxicam improves object recognition memory and modulates glial activation after splenectomy in mice,"CONTEXT: Surgery-induced neuroinflammation has been implicated in the development of postoperative cognitive dysfunction (POCD). OBJECTIVE: To test the hypothesis that meloxicam, a selective cyclooxygenase (COX)-2 inhibitor, preserves postoperative cognitive function and inhibits surgery-induced neuroinflammation in a mouse model. DESIGN: A mouse model of splenectomy-induced inflammation. METHODS: Sixty Swiss Webster male mice (6-8 week old) were randomised into six groups that underwent splenectomy. Animals in groups 1-4 were tested once on day 1, 5, 9 or 14 to determine the time course of delayed transient cognitive dysfunction associated with splenectomy. Animals in groups 5 and 6 were tested once on day 5 or 9 to determine the ability of the NSAID meloxicam to attenuate cognitive dysfunction. INTERVENTION: Animals in groups 1-4 received one dose 500 μl intraperitoneal physiological saline 24 h after splenectomy. Animals in groups 5 and 6 received one dose of intraperitoneal meloxicam (60 mg kg in 500 μl saline) 24 h after splenectomy. MAIN OUTCOME MEASURES: Short-term working memory as determined by Object Recognition Test (ORT) index on days 1, 5, 9 and 14 was the first main outcome. Tomato lectin staining histochemistry of glial cells was assessed on days 1, 5, 9 and 14 as a second main outcome. RESULTS: Compared with day 1 (group 1), the mean ORT indices at day 5 (group 2) and day 9 (group 3) were decreased by 27.5% [95% confidence interval (CI): 0.9 to 54.1%, P = 0.04] and 23.8% (95% CI, 4.3 to 51.9%, P = 0.09), respectively. At day 5 (group 5) and day 9 (group 6), the ORT indices in the meloxicam groups were reduced by 6.6% (95% CI: -11.4 to 24.5%) and 4.3% (95% CI: -25.3 to 34.0). Thus, the administration of meloxicam attenuated the decrease in ORT indices (P = 0.031). Histochemical staining with tomato lectin showed features of microglia activation at day 5 and 9, which was reduced by the administration of meloxicam. CONCLUSION: These findings suggest that COX-2-dependent mechanisms may play a role in the development of POCD. This effect may be dependent on the modulation of glial cell activation.",0,10.1097/eja.0b013e3283534f56
W1768069588,Overexpression of mineralocorticoid receptors does not affect memory and anxiety-like behavior in female mice,"Mineralocorticoid receptors (MRs) have been implicated in behavioral adaptation and learning and memory. Since-at least in humans-MR function seems to be sex-dependent, we examined the behavioral relevance of MR in female mice exhibiting transgenic MR overexpression in the forebrain. Transgenic MR overexpression did not affect contextual fear memory or cued fear learning and memory. Moreover, MR overexpressing and control mice discriminated equally well between fear responses in a combined cue and context fear conditioning paradigm. Also context-memory in an object recognition task was unaffected in MR overexpressing mice. We conclude that MR overexpression in female animals does not affect fear conditioned responses and object recognition memory.",1,10.3389/fnbeh.2015.00182
W2037154303,Cognitive phenotyping of amyloid precursor protein transgenic J20 mice,,0,10.1016/j.bbr.2011.12.021
W2093979706,Short-term testosterone manipulations do not affect cognition or motor function but differentially modulate emotions in young and older male rhesus monkeys,,0,10.1016/j.yhbeh.2014.08.016
W2537341202,Conditioned object preference: an alternative approach to measuring reward learning in rats,"Pavlovian conditioned approach behavior can be directed as much toward discrete cues as it is toward the environmental contexts in which those cues are encountered. The current experiments characterized a tendency of rats to approach object cues whose prior exposure had been paired with reward (conditioned object preference, COP). To demonstrate the phenomenon, rats were conditioned to associate cocaine or saline with two different objects. Rats acquired a preference, assessed using investigation times directed toward each object, for the cocaine-paired object following conditioning. Furthermore, high levels of object investigation during cocaine conditioning predicted stronger preferences for the cocaine-paired object in the test phase. Conditioned approach diminished across extinction but was reinstated through a priming injection of cocaine. To determine whether preferences are affected by reward value, rats were conditioned using three objects paired with 0, 5, or 20 mg/kg of cocaine. This produced object preferences in the post-test that scaled with cocaine dose used for conditioning. Finally, we explored whether contextual cues modulate expression of COP by testing rats for renewal of cocaine seeking. When conditioning was conducted in one context and extinction training in a second context, COP was renewed when the rats were retested in the original context. Thus, conditioned object preferences are readily acquired, easily measured, and amenable to a number of standard Pavlovian conditioning manipulations. This task promises to become a valuable addition to the panoply of behavioral tools available to test mechanisms underlying adaptive and maladaptive reward processing.",0,10.1101/lm.042598.116
W2485677285,The role of postnatal neurogenesis in supporting remote memory and spatial metric processing,"In this study, we determined the contribution of juvenile neurogenesis to the performance of mice on a remote memory for temporally based association task and in a novelty based spatial pattern separation task. This was accomplished by mating homozygous DNMT1-loxP mice with heterozygous GFAP-Cre mice and comparing Cre+ (no postnatal neurogenesis) to Cre- (wild type) littermate offspring. The results indicate that Cre+ mice are impaired relative to Cre- mice in the remote memory for a temporal based association task and in a novelty based spatial pattern separation task. These results support the temporal integration model of Aimone et al., [(2006) Nat Neurosci 9:723-727] and provide further support for an important role for postnatally born neurons in spatial pattern separation. In contrast, Cre+ mice are not impaired relative to Cre- mice in an object-context recognition task and a spatial location recognition task. These latter data suggest that postnatally derived neurons in the dentate gyrus (DG) do not support all spatial and object recognition functions of the DG.",0,10.1002/hipo.22346
W2284644710,Naloxone injections into CA3 disrupt pattern completion associated with relapse from cocaine seeking,"The goal of the present research was to assess the degree to which a pattern completion process operates in cue-induced relapse to cocaine-seeking behavior. Using a novel cue-preference version of the place preference task, rats were administered cocaine or saline, which resulted in a preference for the cocaine-paired cues. After 21 days of abstinence and prior to the preference test, for one group, PBS or naloxone was injected into the CA3 subregion of the hippocampus and for a second group, saline or naloxone was injected systemically. The results indicated that infusions of naloxone into CA3 or systemic injections produced a marked disruption for one and two cues, but had minimal disruptive effect for three or four cues, suggesting that naloxone injections disrupt CA3 function and trigger a deficit in a pattern completion process. Thus, it appears that cue-based activation of the dorsal CA3 might be a critical trigger via a pattern completion process. Based on additional analyses it appears that there is a disruption primarily for object touches for one cue naloxone injections into the CA3 or systemic injections, but no effect on time (spatial context). © 2016 Wiley Periodicals, Inc.",0,10.1002/hipo.22570
W2078414300,Distinct roles of the hippocampus and perirhinal cortex in GABAA receptor blockade-induced enhancement of object recognition memory,,0,10.1016/j.brainres.2014.01.024
W1493717789,Effect of dentate gyrus disruption on remembering what happened where,"Our previous studies using Bax knockout (Bax-KO) mice, in which newly generated granule cells continue to accumulate, disrupting neural circuitry specifically in the dentate gyrus (DG), suggest the involvement of the DG in binding the internally-generated spatial map with sensory information on external landmarks (spatial map-object association) in forming a distinct spatial context for each environment. In order to test whether the DG is also involved in binding the internal spatial map with sensory information on external events (spatial map-event association), we tested the behavior of Bax-KO mice in a delayed-non-match-to-place task. Performance of Bax-KO mice was indistinguishable from that of wild-type mice as long as there was no interruption during the delay period (tested up to 5 min), suggesting that on-line maintenance of working memory is intact in Bax-KO mice. However, Bax-KO mice showed profound performance deficits when they were removed from the maze during the delay period (interruption condition) with a sufficiently long (65 s) delay, suggesting that episodic memory was impaired in Bax-KO mice. Together with previous findings, these results suggest the role of the DG in binding spatial information derived from dead reckoning and nonspatial information, such as external objects and events, in the process of encoding episodic memory.",0,10.3389/fnbeh.2015.00170
W2610559583,Medial temporal pathways for contextual learning: Network c- <i>fos</i> mapping in rats with or without perirhinal cortex lesions,"BACKGROUND: In the rat brain, context information is thought to engage network interactions between the postrhinal cortex, medial entorhinal cortex, and the hippocampus. In contrast, object information is thought to be more reliant on perirhinal cortex and lateral entorhinal cortex interactions with the hippocampus. METHOD: after exposure to a new spatial environment. RESULTS: expression in the prelimbic cortex, retrosplenial cortex and nucleus reuniens of the thalamus appeared unaffected by the perirhinal cortex lesions. CONCLUSION: The perirhinal cortex lesions disrupted network interactions involving the medial entorhinal cortex and the hippocampus, highlighting ways in which perirhinal cortex might affect specific aspects of context learning.",0,10.1177/2398212817694167
W1983920882,Transient brain ischemia due to cardiac arrest causes irreversible long-lasting cognitive injury,,0,10.1016/j.bbr.2010.12.004
W2023854352,Increased Fear Response to Contextual Cues in Mice Lacking the 5-HT1A Receptor,,0,10.1038/sj.npp.1300774
W2073778714,Robust Conjunctive Item–Place Coding by Hippocampal Neurons Parallels Learning What Happens Where,"Previous research indicates a critical role of the hippocampus in memory for events in the context in which they occur. However, studies to date have not provided compelling evidence that hippocampal neurons encode event-context conjunctions directly associated with this kind of learning. Here we report that, as animals learn different meanings for items in distinct contexts, individual hippocampal neurons develop responses to specific stimuli in the places where they have differential significance. Furthermore, this conjunctive coding evolves in the form of enhanced item-specific responses within a subset of the preexisting spatial representation. These findings support the view that conjunctive representations in the hippocampus underlie the acquisition of context-specific memories.",0,10.1523/jneurosci.1378-09.2009
W2736993544,"Neuropeptide Y prolongs non-social memory and differentially affects acquisition, consolidation, and retrieval of non-social and social memory in male mice","Neuropeptide Y (NPY) and its receptors (especially Y1, Y2, and Y5) are highly expressed in brain regions involved in learning and memory processes. Accordingly, NPY was shown to modulate cognitive functions in rodents. Here, we investigated possible memory-enhancing effects of NPY and determined the role of the NPY system in the acquisition, consolidation, and retrieval of non-social and social memory in mice, using the object and social discrimination tests, respectively. Intracerebroventricular (icv) infusion of NPY (1 nmol/2 µl) prolonged retention of non-social (object) memory, but not of social memory. This effect was blocked by the Y1 receptor antagonist BIBO3304 trifluoroacetate (2 nmol/2 µl), but not by the Y2 receptor antagonist BIIE0246 (2 nmol/2 µl). While icv infusion of NPY did not affect the acquisition, consolidation, and retrieval of non-social and social memory, icv infusion of BIBO3304 trifluoroacetate and BIIE0246 blocked the consolidation of non-social memory and the retrieval of both non-social and social memory. This study suggests that NPY has memory-enhancing effects in a non-social context by specifically acting on Y1 receptors. It further suggests that the central NPY system exerts differential effects on the sequential phases of non-social and social memory.",0,10.1038/s41598-017-07273-x
W1988471261,Memory impairments and hippocampal modifications in adult rats with neonatal isolation stress experience,,0,10.1016/j.nlm.2007.03.011
W2144420195,Effect of Simvastatin on Cognitive Functioning in Children With Neurofibromatosis Type 1,"CONTEXT: Neurofibromatosis type 1 (NF1) is among the most common genetic disorders that cause learning disabilities. Recently, it was shown that statin-mediated inhibition of 3-hydroxy-3-methylglutaryl coenzyme A reductase restores the cognitive deficits in an NF1 mouse model. OBJECTIVE: To determine the effect of simvastatin on neuropsychological, neurophysiological, and neuroradiological outcome measures in children with NF1. DESIGN, SETTING, AND PARTICIPANTS: Sixty-two of 114 eligible children (54%) with NF1 participated in a randomized, double-blind, placebo-controlled trial conducted between January 20, 2006, and February 8, 2007, at an NF1 referral center at a Dutch university hospital. INTERVENTION: Simvastatin or placebo treatment once daily for 12 weeks. MAIN OUTCOME MEASURES: Primary outcomes were scores on a Rey complex figure test (delayed recall), cancellation test (speed), prism adaptation, and the mean brain apparent diffusion coefficient based on magnetic resonance imaging. Secondary outcome measures were scores on the cancellation test (standard deviation), Stroop color word test, block design, object assembly, Rey complex figure test (copy), Beery developmental test of visual-motor integration, and judgment of line orientation. Scores were corrected for baseline performance, age, and sex. RESULTS: No significant differences were observed between the simvastatin and placebo groups on any primary outcome measure: Rey complex figure test (beta = 0.10; 95% confidence interval [CI], -0.36 to 0.56); cancellation test (beta = -0.19; 95% CI, -0.67 to 0.29); prism adaptation (odds ratio = 2.0; 95% CI, 0.55 to 7.37); and mean brain apparent diffusion coefficient (beta = 0.06; 95% CI, -0.07 to 0.20). In the secondary outcome measures, we found a significant improvement in the simvastatin group in object assembly scores (beta = 0.54; 95% CI, 0.08 to 1.01), which was specifically observed in children with poor baseline performance (beta = 0.80; 95% CI, 0.29 to 1.30). Other secondary outcome measures revealed no significant effect of simvastatin treatment. CONCLUSION: In this 12-week trial, simvastatin did not improve cognitive function in children with NF1. Trial Registration isrctn.org Identifier: ISRCTN14965707.",0,10.1001/jama.300.3.287
W2087931458,Neurochemical and electrophysiological deficits in the ventral hippocampus and selective behavioral alterations caused by high-fat diet in female C57BL/6 mice,,0,10.1016/j.neuroscience.2015.03.068
W2013776593,PDE9A inhibition rescues amyloid beta-induced deficits in synaptic plasticity and cognition,,0,10.1016/j.neurobiolaging.2014.03.023
W2116342174,Behavioral and neurochemical consequences of lipopolysaccharide in mice: anxiogenic-like effects,,0,10.1016/s0006-8993(98)01288-8
W2171098903,Oestradiol Modulation of Cognition in Adult Female Marmosets (<i>Callithrix jacchus</i>),"The common marmoset (Callithrix jacchus) provides many advantages over traditional rodent and macaque species as a model for human ageing and may be very useful for studying the effects of sex steroids on cognitive and brain ageing. We present the first study examining the effects of oestrogens on cognitive function in female marmosets. Adult monkeys (3-5 years of age) were trained to a specific learning criterion on a battery of cognitive tasks preoperatively (object discrimination, delayed response with increasing delays and detour reaching with opaque box) and were tested on different versions of these tasks (object reversals, delayed response with randomised delays and detour reaching with clear box) after ovariectomy and simultaneous implantation with 17β-oestradiol (E2 ) (n = 6) or blank (n = 6) Silastic capsules. Acquisition of a delayed matching-to-position task with a 1-s delay was also administered after completion of these tests. E2 -treated monkeys were significantly impaired on the second reversal and showed an increase in perseverative responding from reversals 1-3. Their performance also tended to be worse than that of control monkeys on the delayed response task. Performance acquisition on the delayed matching-to-position tended to be better in E2 -treated relative to control monkeys, although the group difference did not reach statistical significance. No effect of treatment was detected for detour reaching or affiliative behaviours. Overall, the findings indicate that E2 compromises performance on prefrontally-mediated tasks. The suggestion that E2 may improve acquisition on tasks dependent on the hippocampus will require further validation. These results are discussed in the context of dopaminergic and serotonergic signalling. We conclude that the marmoset is a useful new primate model for examining the effects of oestrogens on cognitive function.",0,10.1111/jne.12147
W2907304234,Flumazenil but not bicuculline counteract the impairing effects of anesthetic ketamine on recognition memory in rats. Evidence for a functional interaction between the GABAA-benzodiazepine receptor and ketamine?,,0,10.1016/j.neuropharm.2018.12.030
W2181255710,Angiotensin-(1-7)/Mas axis modulates fear memory and extinction in mice,,0,10.1016/j.nlm.2015.11.012
W2033778885,Effect of combining anesthetics in neonates on long‐term cognitive function,"BACKGROUND: With growing evidence that anesthesia exposure in infancy affects cognitive development, it is important to understand how distinct anesthetic agents and combinations can alter long-term memory. Investigations of neuronal death suggest that combining anesthetic agents increases the extent of neuronal injury. However, it is unclear how the use of simultaneously combined anesthetics affects cognitive outcome relative to the use of a single agent. METHODS: Postnatal day 7 (P7) male rats were administered either sevoflurane as a single agent or the combined delivery of sevoflurane with nitrous oxide at 1 Minimum Alveolar Concentration for 4 h. Behavior was assessed in adulthood using the forced alternating T-maze, social recognition, and context-specific object recognition tasks. RESULTS: Animals exposed to either anesthetic were unimpaired in the forced alternating T-maze test and had intact social recognition. Subjects treated with the combined anesthetic displayed a deficit, however, in the object recognition task, while those treated with sevoflurane alone were unaffected. CONCLUSION: A combined sevoflurane and nitrous oxide anesthetic led to a distinct behavioral outcome compared with sevoflurane alone, suggesting that the simultaneous use of multiple agents may uniquely influence early neural and cognitive development and potentially impacts associative memory.",0,10.1016/j.ijdevneu.2014.06.016
W2126933775,Learning-dependent Changes in the Neuronal Correlates of Response Inhibition in the Prefrontal Cortex and Hippocampus,"It has been suggested that the hippocampus and the prefrontal cortex (PFC) play key roles in representing contextual memory and utilizing contextual information for flexible response selection. During response selection, a correct response should be facilitated and an incorrect response should be inhibited flexibly in association with a cueing stimulus. However, it is poorly understood how the hippocampal and PFC networks behave during such flexible control of facilitation and inhibition of behavioral responses. To find neural correlates of context-cued flexible response selection, the current study employed an object-place paired-associate (OPPA) task in which object A is only rewarded in place 1 and object B is associated with reward in place 2 while recording single units simultaneously from the hippocampus and PFC. During the task, response inhibition in front of a contextually wrong object is required for successful performance and such inhibitory responses were observed before the rat learned the task. A significant proportion of neurons that fired differentially depending on the existence of inhibitory behavior in the PFC was observed during the pre-learning stage. By contrast, the proportion of such neurons in the hippocampus was significantly greater than chance during post-learning stage. The results suggest that the development of inhibitory behavior is a critical behavioral marker that foretells an upcoming acquisition of the task and the hippocampus and PFC are involved in learning contextual response selection by learning how to control the inhibition of behavior as learning progresses.",0,10.5607/en.2014.23.2.178
W2034399385,Putting an object in context and acting on it: neural mechanisms of goal-directed response to contextual object,"Animals including humans experience objects in a certain environment, that is, a context. Same objects may have to be treated differently, or different objects may need to be treated similarly depending on contexts. Flexible behavioral choice in such ambiguous situations involves dynamic interactions among brain regions, but underlying neural mechanisms are poorly understood. In this article, prior studies that have examined (mostly in rodents) some of the brain regions involved in contextual processing of object information using goal-directed tasks are selectively reviewed. The current review identifies the hippocampus, prefrontal cortex (PFC) and perirhinal cortex (PER) as key regions for associating the same objects with different reward values and responses depending on the background visual context. The hippocampus is particularly important for contextual choice behavior when the context must be used as a conditional cue that can disambiguate reward-related 'meanings' of objects. The PER appears to play significant roles in such tasks during initial learning (but not so much for retrieval) because perturbations in the PER produce severe deficits in the acquisition of the contextual object memory task. Perturbations in the PFC also affect performance when flexible contextual responses should be made toward otherwise ambiguous objects.",0,10.1515/revneuro-2012-0073
