paper_id,title,abstract,label,doi
W2538563026,Determinants of object‐in‐context and object‐place‐context recognition in the developing rat,"Since the seminal report on novel object recognition in the rat (Ennaceur & Delacour, 1988), novelty recognition paradigms have become increasingly prevalent in learning and memory research. Novelty recognition tasks do not require extensive training or complex behaviors, and thus are especially suitable for studying the ontogeny of various forms of memory (e.g., object, spatial, and contextual memory). However, relatively little is known about the determinants of recognition memory during development. The present study extends our recent research on the development of recognition memory by further characterizing the ontogeny of contextual recognition (Ramsaran, Westbrook, & Stanton, 2016). We report that long-term retention of object-in-context (OiC) memory emerges during early development in the rat (Experiment 1), and that performance of object-place-context (OPC), a spatial variant of the OiC task, also displays protracted development until early adolescence (Experiment 2). In addition, we examined the role of NMDA receptors (NMDARs) in contextual recognition and found that OiC memory is not dependent on NMDAR-mediated plasticity whereas performance of spatial task variants including the distal cue OiC (Ramsaran et al., 2016) and OPC tasks are NMDAR-dependent (Experiments 3 and 4). The ontogeny of contextual recognition is influenced by memory retention and spatial processing demands, which may also determine the neurobiological mechanisms supporting task performance.",1,10.1002/dev.21432
W2053797489,Ontogeny of object-in-context recognition in the rat,,1,10.1016/j.bbr.2015.04.011
W2066759207,Relative recency influences object-in-context memory,"In two experiments rats received training on an object-in-context (OIC) task, in which they received preexposure to object A in context x, followed by exposure to object B in context y. In a subsequent test both A and B are presented in either context x or context y. Usually more exploration is seen of the object that has not previously been paired with the test context, an effect attributed to the ability to remember where an object was encountered. However, in the typical version of this task, object A has also been encountered less recently than object B at test. This is precisely the arrangement in tests of 'relatively recency' (RR), in which more remotely presented objects are explored more than objects experienced more recently. RR could contaminate performance on the OIC task, by enhancing the OIC effect when animals are tested in context y, and masking it when the test is in context x. This possibility was examined in two experiments, and evidence for superior performance in context y was obtained. The implications of this for theoretical interpretations of recognition memory and the procedures used to explore it are discussed.",1,10.1016/j.bbr.2014.12.024
W2515086381,Blockade of hippocampal bradykinin B1 receptors improves spatial learning and memory deficits in middle-aged rats,,0,10.1016/j.bbr.2016.08.041
W1926193477,"Dentate gyrus supports slope recognition memory, shades of grey-context pattern separation and recognition memory, and CA3 supports pattern completion for object memory",,0,10.1016/j.nlm.2015.08.010
W2530543946,Recognition memory is selectively impaired in adult rats exposed to binge-like doses of ethanol during early postnatal life,,1,10.1016/j.alcohol.2016.09.027
W2009539224,Co-morbid beta-amyloid toxicity and stroke produce impairments in an ambiguous context task in rats without any impairment in spatial working memory,,0,10.1016/j.nlm.2015.01.001
W2005543438,Sleep enhances inhibitory behavioral control in discrimination learning in rats,"Sleep supports the consolidation of memory, and it has been proposed that this enhancing effect of sleep pertains in particular to memories which are encoded under control of prefrontal-hippocampal circuitry into an episodic memory system. Furthermore, repeated reactivation and transformation of such memories during sleep are thought to promote the de-contextualization of these memories. Here, we aimed to establish a behavioral model for the study of such sleep-dependent system consolidation in rats, using a go/nogo conditional discrimination learning task known to essentially depend on prefrontal-hippocampal function. Different groups of rats were trained to criterion on this task and, then, subjected to 80-min retention intervals filled with spontaneous morning sleep, sleep deprivation, or spontaneous evening wakefulness. In a subsequent test phase, the speed of relearning of the discrimination task was examined as indicator of memory, whereby rats were either tested in the same context as during training or in a different context. Sleep promoted relearning of the conditional discrimination task, and this effect was similar for testing memory in the same or different context (p < 0.001). Independent of sleep and wakefulness during the retention interval, animals showed faster relearning when tested in the same context as during learning, compared with testing in a different context (p < 0.001). The benefitting effect of sleep on discrimination learning was primarily due to an enhancing effect on response suppression during the nogo stimulus. We infer from these results that sleep enhances memory for inhibitory behavioral control in a generalized context-independent manner and thereby might eventually also contribute to the abstraction of schema-like representations.",0,10.1007/s00221-013-3797-5
W2537813959,Evidence of a role for orbital prefrontal cortex in preventing over-generalization to moderate predictors of biologically significant events,,0,10.1016/j.neuroscience.2016.10.017
W2606834381,Disconnection of the Perirhinal and Postrhinal Cortices Impairs Recognition of Objects in Context But Not Contextual Fear Conditioning,"Representations of context are important for perception, memory, decision making, and other cognitive processes. Moreover, there is extensive evidence that the use of contextual representations to guide appropriate behavior is disrupted in neuropsychiatric and neurological disorders including developmental disorders, schizophrenia, affective disorders, and Alzheimer's disease. Many of these disorders are accompanied by changes in parahippocampal and hippocampal structures. Understanding how context is represented in the brain and how parahippocampal structures are involved will enhance our understanding and treatment of the cognitive and behavioral symptoms associated with neurological disorders and neuropsychiatric disease.",1,10.1523/jneurosci.0254-17.2017
W1596003199,Retroactive interference of object‐in‐context long‐term memory: Role of dorsal hippocampus and medial prefrontal cortex,"Retroactive interference (RI) is a type of amnesia in which a new learning experience can impair the expression of a previous one. It has been studied in several types of memories for over a century. Here, we aimed to study in the long-term memory (LTM) formation of an object-in-context task, defined as the recognition of a familiar object in a context different to that in which it was previously encountered. We trained rats with two sample trials, each taking place in a different context in association with different objects. Test sessions were performed 24 h later, to evaluate LTM for both object-context pairs using separate groups of trained rats. Furthermore, given the involvement of hippocampus (Hp) and medial prefrontal cortex (mPFC) in several recognition memories, we also analyzed the participation of these structures in the LTM formation of this task by the local infusion of muscimol. Our results show that object-in-context LTM formation is sensitive to RI by a different either familiar or novel object-context pair trial, experienced 1 h later. This interference occurs in a restricted temporal window and works on the LTM consolidation phase, leaving intact short-term memory expression. The second sample trial did not affect the object recognition part of the memory. Besides, muscimol treatment before the second sample trial blocks its object-in-context LTM and restores the first sample trial memory. We hypothesized that LTM-RI amnesia is probably caused by resources or cellular machinery competition in these brain regions when they are engaged in memory formation of the traces. In sum, when two different object-in-context memory traces are being processed, the second trace interferes with the consolidation of the first one requiring mPFC and CA1 dorsal Hp activation.",1,10.1002/hipo.22328
W2007510319,"Systemic lipopolysaccharide administration impairs retrieval of context–object discrimination, but not spatial, memory: Evidence for selective disruption of specific hippocampus-dependent memory functions during acute neuroinflammation",,1,10.1016/j.bbi.2014.09.014
W2057620464,Early Exposure to Volatile Anesthetics Impairs Long-Term Associative Learning and Recognition Memory,"BACKGROUND: Anesthetic exposure early in life affects neural development and long-term cognitive function, but our understanding of the types of memory that are altered is incomplete. Specific cognitive tests in rodents that isolate different memory processes provide a useful approach for gaining insight into this issue. METHODS: Postnatal day 7 (P7) rats were exposed to either desflurane or isoflurane at 1 Minimum Alveolar Concentration for 4 h. Acute neuronal death was assessed 12 h later in the thalamus, CA1-3 regions of hippocampus, and dentate gyrus. In separate behavioral experiments, beginning at P48, subjects were evaluated in a series of object recognition tests relying on associative learning, as well as social recognition. RESULTS: Exposure to either anesthetic led to a significant increase in neuroapoptosis in each brain region. The extent of neuronal death did not differ between groups. Subjects were unaffected in simple tasks of novel object and object-location recognition. However, anesthetized animals from both groups were impaired in allocentric object-location memory and a more complex task requiring subjects to associate an object with its location and contextual setting. Isoflurane exposure led to additional impairment in object-context association and social memory. CONCLUSION: Isoflurane and desflurane exposure during development result in deficits in tasks relying on associative learning and recognition memory. Isoflurane may potentially cause worse impairment than desflurane.",1,10.1371/journal.pone.0105340
W2558267228,Cisplatin-induced mitochondrial dysfunction is associated with impaired cognitive function in rats,,1,10.1016/j.freeradbiomed.2016.11.046
W2903030538,Prenatal and early life exposure to air pollution induced hippocampal vascular leakage and impaired neurogenesis in association with behavioral deficits,"Exposure to traffic-related air pollution (TRAP) is associated with a range of neurodevelopmental disorders in human populations. In rodent models, prenatal TRAP exposure increased depressive behaviors and increased brain microglial activity. To identify cellular mechanisms, we examined adult neurogenesis and the blood-brain barrier (BBB) in relation to cognition and motivated behaviors in rats that were exposed to a nano-sized TRAP subfraction from gestation into adulthood. At age 5 months, exposed male rats had 70% fewer newly generated neurons in the dentate gyrus (DG) of the hippocampus. Microglia were activated in DG and CA1 subfields (35% more Iba1). The BBB was altered, with a 75% decrease of the tight junction protein ZO-1 in the CA1 layer, and twofold more iron deposits, a marker of microhemorrhages. The exposed rats had impaired contextual memory (novel object in context), reduced food-seeking behavior, and increased depressive behaviors (forced swim). Deficits of de novo neurogenesis were inversely correlated with depressive behavior, whereas increased microbleeds were inversely correlated with deficits in contextual memory. These findings give the first evidence that prenatal and early life exposure to TRAP impairs adult hippocampal neurogenesis and increases microbleeds in association with behavioral deficits.",1,10.1038/s41398-018-0317-1
W2083829536,The role of the dorsal dentate gyrus in object and object-context recognition,,0,10.1016/j.nlm.2013.07.013
W1924717691,The importance of the context in the hippocampus and brain related areas throughout the performance of a fear conditioning task,"The importance context has been broadly studied in the management of phobias and in the drug addiction literature. The way in which changes to a context influence behavior after the simple acquisition of a passive avoidance task remains unclear. The hippocampus has long been implicated in the contextual and spatial processing required for contextual fear, but its role in encoding the aversive component of a contextual fear memory is still inconclusive. Our work tries to elucidate whether a change in context, represented as differences in the load of the stimuli, is critical for learning about the context-shock association and whether this manipulation of the context could be linked to any change in metabolic brain activity requirements. For this purpose, we used an avoidance conditioning task. Animals were divided into three different experimental conditions. In one group, acquisition was performed in an enriched stimuli environment and retention was performed in a typically lit chamber (the PA-ACQ-CONTX group). In another group, acquisition was performed in the typically lit chamber and retention was undertaken in the highly enriched chamber (the PA-RET-CONTX group). Finally, for the control group, PA-CN-CONTX, acquisition, and retention were performed in the enriched stimuli environment. Our results showed that the PA-ACQ-CONTX group had longer escape latencies and poorer retention than the PA-RET-CONTX and PA-CN-CONTX groups after 24 h of acquisition under contextual changes. To study metabolic brain activity, histochemical labelling of cytochrome c-oxidase (CO) was performed. CO results suggested a neural circuit including the hippocampus, amygdala, thalamus, parahippocampal cortices, and mammillary nuclei that is involved in the learning and memory processes that enable context-dependent behavior. These results highlight how dysfunction in this network may be involved in the contextualization of fear associations that underlie several forms of psychopathology, including post-traumatic stress disorder, schizophrenia, and substance abuse disorders.",0,10.1002/hipo.22430
W2759520145,Early-life sugar consumption has long-term negative effects on memory function in male rats,"OBJECTIVES: Added dietary sugars contribute substantially to the diet of children and adolescents in the USA, and recent evidence suggests that consuming sugar-sweetened beverages (SSBs) during early life has deleterious effects on hippocampal-dependent memory function. Here, we test whether the effects of early-life sugar consumption on hippocampal function persist into adulthood when access to sugar is restricted to the juvenile/adolescent phase of development. METHODS: Male rats were given ad libitum access to an 11% weight-by-volume sugar solution (made with high fructose corn syrup-55) throughout the adolescent phase of development (post-natal day (PN) 26-56). The control group received a second bottle of water instead, and both groups received ad libitum standard laboratory chow and water access throughout the study. At PN 56 sugar solutions were removed and at PN 175 rats were subjected to behavioral testing for hippocampal-dependent episodic contextual memory in the novel object in context (NOIC) task, for anxiety-like behavior in the Zero maze, and were given an intraperitoneal glucose tolerance test. RESULTS: Early-life exposure to SSBs conferred long-lasting impairments in hippocampal-dependent memory function later in life- yet had no effect on body weight, anxiety-like behavior, or glucose tolerance. A second experiment demonstrated that NOIC performance was impaired at PN 175 even when SSB access was limited to 2 hours daily from PN 26-56. DISCUSSION: Our data suggest that even modest SSB consumption throughout early life may have long-term negative consequences on memory function during adulthood.",1,10.1080/1028415x.2017.1378851
W1206090659,Long-term effects of neonatal exposure to MK-801 on recognition memory and excitatory–inhibitory balance in rat hippocampus,,1,10.1016/j.neuroscience.2015.09.003
W2098430271,Lateral entorhinal cortex is critical for novel object‐context recognition,"Episodic memory incorporates information about specific events or occasions including spatial locations and the contextual features of the environment in which the event took place. It has been modeled in rats using spontaneous exploration of novel configurations of objects, their locations, and the contexts in which they are presented. While we have a detailed understanding of how spatial location is processed in the brain relatively little is known about where the nonspatial contextual components of episodic memory are processed. Initial experiments measured c-fos expression during an object-context recognition (OCR) task to examine which networks within the brain process contextual features of an event. Increased c-fos expression was found in the lateral entorhinal cortex (LEC; a major hippocampal afferent) during OCR relative to control conditions. In a subsequent experiment it was demonstrated that rats with lesions of LEC were unable to recognize object-context associations yet showed normal object recognition and normal context recognition. These data suggest that contextual features of the environment are integrated with object identity in LEC and demonstrate that recognition of such object-context associations requires the LEC. This is consistent with the suggestion that contextual features of an event are processed in LEC and that this information is combined with spatial information from medial entorhinal cortex to form episodic memory in the hippocampus.",1,10.1002/hipo.22095
W2126189390,Noradrenergic activation of the basolateral amygdala modulates the consolidation of object-in-context recognition memory,"Noradrenergic activation of the basolateral complex of the amygdala (BLA) is well known to enhance the consolidation of long-term memory of highly emotionally arousing training experiences. The present study investigated whether such noradrenergic activation of the BLA also influences the consolidation of object-in-context recognition memory, a low-arousing training task assessing episodic-like memory. Male Sprague-Dawley rats were exposed to two identical objects in one context for either 3 or 10 min, immediately followed by exposure to two other identical objects in a distinctly different context. Immediately after the training they received bilateral intra-BLA infusions of norepinephrine (0.3, 1.0, or 3.0 μ g) or the β-adrenoceptor antagonist propranolol (0.1, 0.3, or 1.0 μ g). On the 24-h retention test, rats were placed back into one of the training contexts with one copy of each of the two training objects. Thus, although both objects were familiar, one of the objects had not previously been encountered in this particular test context. Hence, if the animal generated a long-term memory for the association between an object and its context, it would spend significantly more time exploring the object that was not previously experienced in this context. Saline-infused control rats exhibited poor 24-h retention when given 3 min of training and good retention when given 10 min of training. Norepinephrine administered after 3 min of object-in-context training induced a dose-dependent memory enhancement, whereas propranolol administered after 10 min of training produced memory impairment. These findings provide evidence that post-training noradrenergic activation of the BLA also enhances the consolidation of memory of object-in-context recognition training, enabling accuracy of episodic-like memories.",1,10.3389/fnbeh.2014.00160
W2143056578,"Associative recognition and the hippocampus: Differential effects of hippocampal lesions on object‐place, object‐context and object‐place‐context memory","The hippocampus is thought to be required for the associative recognition of objects together with the spatial or temporal contexts in which they occur. However, recent data showing that rats with fornix lesions perform as well as controls in an object-place task, while being impaired on an object-place-context task (Eacott and Norman (2004) J Neurosci 24:1948-1953), suggest that not all forms of context-dependent associative recognition depend on the integrity of the hippocampus. To examine the role of the hippocampus in context-dependent recognition directly, the present study tested the effects of large, selective, bilateral hippocampus lesions in rats on performance of a series of spontaneous recognition memory tasks: object recognition, object-place recognition, object-context recognition and object-place-context recognition. Consistent with the effects of fornix lesions, animals with hippocampus lesions were impaired only on the object-place-context task. These data confirm that not all forms of context-dependent associative recognition are mediated by the hippocampus. Subsequent experiments suggested that the object-place task does not require an allocentric representation of space, which could account for the lack of impairment following hippocampus lesions. Importantly, as the object-place-context task has similar spatial requirements, the selective deficit in object-place-context recognition suggests that this task requires hippocampus-dependent neural processes distinct from those required for allocentric spatial memory, or for object memory, object-place memory or object-context memory. Two possibilities are that object, place, and context information converge only in the hippocampus, or that recognition of integrated object-place-context information requires a hippocampus-dependent mode of retrieval, such as recollection.",1,10.1002/hipo.20714
W2061309038,Episodic-like memory: New perspectives from a behavioral test in rats,"In order to have a tool to empirically test the ideas derived from a theoretical model, we extended a protocol for evaluation of episodic-like memory in rats, based on the triad ""what, where, context"" for definition of memories. As with the computational model, our intention was for the animal being tested to store a specific number of object-place-context configurations as different memories, which would then be retrievable from cues. The aim of this work was to evaluate the influence of the number of configurations to be memorized on the performance of the task. Sixty-five Wistar male rats were evaluated. In accordance with previous work, for two configurations, the recognition index was indicative of recognition of the element mismatching the original memory (mean = 0.28; SEM = 0.12). The recognition index for three configurations was lower (mean = 0.15; SEM = 0.10), evidencing less recall with increasing requirements. The results also showed a trend toward recognition of novelty for the first and the last memory when evaluating three configurations (a ""U"" shape in the exploratory preference's curve), showing the primacy and recency effects typical of memory both in humans and animals. Nonetheless, the data presented a high inter-subject variability which makes the test non-robust for small groups. However, if used before and after a treatment for a same subject, we suggest that the protocol presented in this work can be a useful behavioral test for the evaluation of episodic-like memory in rats in terms of a variable task demand.",0,10.1142/s021963521250001x
W1981925277,"Diet, age, and prior injury status differentially alter behavioral outcomes following concussion in rats",,1,10.1016/j.nbd.2014.09.003
W2104890863,Role of Medial Prefrontal Cortex Serotonin 2A Receptors in the Control of Retrieval of Recognition Memory in Rats,"Often, retrieval cues are not uniquely related to one specific memory, which could lead to memory interference. Controlling interference is particularly important during episodic memory retrieval or when remembering specific events in a spatiotemporal context. Despite a clear involvement of prefrontal cortex (PFC) in episodic memory in human studies, information regarding the mechanisms and neurotransmitter systems in PFC involved in memory is scarce. Although the serotoninergic system has been linked to PFC functionality and modulation, its role in memory processing is poorly understood. We hypothesized that the serotoninergic system in PFC, in particular the 5-HT2A receptor (5-HT2AR) could have a role in the control of memory retrieval. In this work we used different versions of the object recognition task in rats to study the role of the serotoninergic modulation in the medial PFC (mPFC) in memory retrieval. We found that blockade of 5-HT2AR in mPFC affects retrieval of an object in context memory in a spontaneous novelty preference task, while sparing single-item recognition memory. We also determined that 5-HT2ARs in mPFC are required for hippocampal-mPFC interaction during retrieval of this type of memory, suggesting that the mPFC controls the expression of memory traces stored in the hippocampus biasing retrieval to the most relevant one.",1,10.1523/jneurosci.2087-13.2013
